<?xml version="1.0"?>
<!DOCTYPE VOTABLE SYSTEM "http://us-vo.org/xml/VOTable.dtd">
<VOTABLE version="1.3">
<DESCRIPTION>Sample VOTable that tries to exercize the options</DESCRIPTION>
<RESOURCE>
<TABLE>

<FIELD ID="booleanFix" datatype="boolean" arraysize="2x2"/>
<FIELD ID="booleanVar" datatype="boolean" arraysize="*"/>

<FIELD ID="bitFix" datatype="bit" arraysize="2x2"/>
<FIELD ID="bitVar" datatype="bit" arraysize="*"/>

<FIELD ID="unsignedByteFix" datatype="unsignedByte" arraysize="2x2"/>
<FIELD ID="unsignedByteVar" datatype="unsignedByte" arraysize="*"/>

<FIELD ID="shortFix" datatype="short" arraysize="2x2"/>
<FIELD ID="shortVar" datatype="short" arraysize="*"/>

<FIELD ID="intFix" datatype="int" arraysize="2x2"/>
<FIELD ID="intVar" datatype="int" arraysize="*"/>

<FIELD ID="longFix" datatype="long" arraysize="2x2"/>
<FIELD ID="longVar" datatype="long" arraysize="*"/>

<FIELD ID="charFix" datatype="char" arraysize="2x2"/>
<FIELD ID="charVar" datatype="char" arraysize="*"/>

<FIELD ID="unicodeCharFix" datatype="unicodeChar" arraysize="2x2"/>
<FIELD ID="unicodeCharVar" datatype="unicodeChar" arraysize="*"/>

<FIELD ID="floatFix" datatype="float" arraysize="2x2"/>
<FIELD ID="floatVar" datatype="float" arraysize="*"/>

<FIELD ID="doubleFix" datatype="double" arraysize="2x2"/>
<FIELD ID="doubleVar" datatype="double" arraysize="*"/>

<FIELD ID="floatComplexFix" datatype="floatComplex" arraysize="2x2"/>
<FIELD ID="floatComplexVar" datatype="floatComplex" arraysize="*"/>

<FIELD ID="doubleComplexFix" datatype="doubleComplex" arraysize="2x2"/>
<FIELD ID="doubleComplexVar" datatype="doubleComplex" arraysize="*"/>


<DATA>
<TABLEDATA>

<TR>
<TD>T f T F</TD> <TD>T T t F f f</TD>
<TD>0 1 0 1</TD> <TD>1 0 1 0 1 0</TD>
<TD>10 11 12 13</TD> <TD>10 11 12 13 14 15</TD>
<TD>10 11 12 13</TD> <TD>10 11 12 13 14 15</TD>
<TD>10 11 12 13</TD> <TD>10 11 12 13 14 15</TD>
<TD>10 11 12 13</TD> <TD>10 11 12 13 14 15</TD>
<TD>ABCD</TD> <TD>ABCDEF</TD>
<TD>ABCD</TD> <TD>ABCDEF</TD>
<TD>1.1 10.2 20.3 40.4</TD> <TD>1.1 3.2 5.3 7.4 9.5 11.6</TD>
<TD>1.1 10.2 20.3 40.4</TD> <TD>1.1 3.2 5.3 7.4 9.5 11.6</TD>
<TD>1.1 9.0 1.2 9.0 1.3 9.0 1.4 9.0</TD> <TD>1.1 9.0 1.2 9.0 1.3 9.0 1.4 9.0 1.5 9.0 1.6 9.0</TD>
<TD>1.1 9.0 1.2 9.0 1.3 9.0 1.4 9.0</TD> <TD>1.1 9.0 1.2 9.0 1.3 9.0 1.4 9.0 1.5 9.0 1.6 9.0</TD>
</TR>

<TR>
<TD>T f T F</TD> <TD>T T t F f f T 0 1 0 1 T F t t F</TD>
<TD>0 1 0 1</TD> <TD>1 0 1 0 1 0 1 0 1 0 1 0</TD>
<TD>10 11 12 13</TD> <TD>10 11 12 13 14 15 16 17 18 19</TD>
<TD>10 11 12 13</TD> <TD>10 11 12 13 14 15 16 17 18 19</TD>
<TD>10 11 12 13</TD> <TD>10 11 12 13 14 15 16 17 18 19</TD>
<TD>10 11 12 13</TD> <TD>10 11 12 13 14 15 16 17 18 19</TD>
<TD>ABCD</TD> <TD>ABCDEFGHIJK</TD>
<TD>ABCD</TD> <TD>ABCDEFGHIJK</TD>
<TD>1.1 1.2 1.3 1.4</TD> <TD>1.1 1.2 1.3 1.4 1.5 1.6 1.7 1.8 1.9</TD>
<TD>1.1 1.2 1.3 1.4</TD> <TD>1.1 1.2 1.3 1.4 1.5 1.6 1.7 1.8 1.9</TD>
<TD>1.1 9.0 1.2 9.0 1.3 9.0 1.4 9.0</TD> <TD>1.1 9.0 1.2 9.0 1.3 9.0 1.4 9.0 1.5 9.0 1.6 9.0 1.7 9.0 1.8 9.0 1.9 9.0</TD>
<TD>1.1 9.0 1.2 9.0 1.3 9.0 1.4 9.0</TD> <TD>1.1 9.0 1.2 9.0 1.3 9.0 1.4 9.0 1.5 9.0 1.6 9.0 1.7 9.0 1.8 9.0 1.9 9.0</TD>
</TR>

</TABLEDATA>
</DATA>
</TABLE>
</RESOURCE>
</VOTABLE>
